FechaCierre,Descripcion,Estado,CodigoTipo,TipoConvocatoria,MontoEstimado,Modalidad,EmailResponsablePago,Comprador.NombreOrganismo,Comprador.NombreUnidad,Comprador.ComunaUnidad,Comprador.RegionUnidad,Comprador.NombreUsuario,Comprador.CargoUsuario
2025-10-06 15:00:00,REPOSICIÓN Y MEJORAMIENTO MULTICANCHAS MIQUEAS Y CHANCURA COMUNA DE MAIPÚ,,,,,,,,,,,,
2025-10-06 15:01:00,CONTRATACIÓN DE CURSOS DE CAPACITACIÓN ENMARCADOS EN EL PLAN ANUAL DE CAPACITACIÓN AÑO 2025,,,,,,,,,,,,
2025-10-15 15:30:00,ARRIENDO DE VEHÍCULOS CON CHOFER Y COMBUSTIBLE PARA FUNCIONES MUNICIPALES SALUD Y SMAPA PERIODO 18 MESES,,,,,,,,,,,,
2025-10-23 17:00:00,SERVICIO DE CORTE Y REPOSICIÓN DE AGUA POTABLE SMAPA,,,,,,,,,,,,
2025-10-15 14:00:00,SERVICIO DE MANTENIMIENTO E INSTALACIÓN DE BALIZAS PEATONALES COMUNA DE MAIPÚ,,,,,,,,,,,,
2025-11-03 15:01:00,“EXTRACIÓN SUMINISTRO INSTALACIÓN REPARACIÓN Y MANTENCIÓN DE ELECTROBOMBAS SUMERGIBLES E INFRAESTRUCTURA ANEXA DE LAS PLANTAS ELEVADORAS DE AGUAS SERVIDAS DE SMAPA”,,,,,,,,,,,,
2025-10-30 11:00:00,CONSTRUCCIÓN MULTICANCHA Y MEJORAMIENTO PLAZA CARACOL MAIPÚ CÓDIGO 1-C-2023-3284,,,,,,,,,,,,
2025-10-13 15:01:00,SUMINISTRO DE VESTIMENTA INSTITUCIONAL PARA LOS FUNCIONARIOS DE LA DIRECCIÓN DE DESARROLLO COMUNITARIO,,,,,,,,,,,,
2025-10-20 17:00:00,“ADQUISICIÓN DE ELECTROCARDIÓGRAFOS”,,,,,,,,,,,,
2025-10-22 15:00:00,“SERVICIO DE ESTUDIO HISTOPATOLÓGICO DE BIOPSIA PARA SALA DE CIRUGÍA MENOR”,,,,,,,,,,,,
2025-11-03 15:01:00,SERVICIO DE LIMPIEZA DE FOSAS POZOS NEGROS Y CÁMARAS DE ALCANTARILLADO EN LA COMUNA DE MAIPÚ,,,,,,,,,,,,
2025-10-06 15:00:00,“SERVICIO DE DISPOSICIÓN FINAL DE LOS RESIDUOS SOL,,,,,,,,,,,,
2025-10-09 15:00:00,Construcción Gimnasio al Aire Libre Chiguayante,,,,,,,,,,,,
2025-10-13 15:01:00,PROYECTOS INFRAESTRUCTURA CONVENIOS 2025,,,,,,,,,,,,
2025-10-06 15:30:00,SP: 170290 - DAO: “Servicio de operación mantenimiento y ajustes operacionales de las plantas de tratamiento de aguas servidas ptas La Granja y Rio Claro de Popeta” según Términos de Requerimiento N°146 MemorandumN°187 y CDP N°1608,,,,,,,,,,,,
2025-10-27 15:01:00,LA ILUSTRE MUNICIPALIDAD DE RENGO LLAMA A LICITACIÓN PARA CONTRATAR LA CONCESIÓN DE SERVICIO DE RECOLECCIÓN TRANSPORTE Y DISPOSICIÓN DE RESIDUOS DOMICILIARIOS COMUNA DE RENGO.,,,,,,,,,,,,
2025-10-06 16:00:00,POR SP 169662 – DIDECO. LA ILUSTRE MUNICIPALIDAD DE RENGO LLAMA A LICITACIÓN PÚBLICA PARA LA - Contratación del “Servicio de producción y desarrollo de eventos del programa comunitario “Mes de los grandes”.,,,,,,,,,,,,
2025-10-07 18:01:00,CONTRATACION DE SERVICIOS PERSONALES ESPECIALIZADOS PARA LA ILUSTRE MUNICIPALIDAD DE RENGO,,,,,,,,,,,,
2025-10-08 15:30:00,CONTRATACIÓN DE SERVICIOS PERSONALES ESPECIALIZADOS PARA LA ILUSTRE MUNICIPALIDAD DE RENGO” - INGENIERO CIVIL INDUSTRIAL O INGENIERO EN ADMINISTRACIÓN,,,,,,,,,,,,
2025-10-08 15:30:00,CONTRATACION DE SERVICIOS TÉCNICOS Y PROFESIONALES PARA LA ILUSTRE MUNICIPALIDAD DE RENGO: INGENIERO EN PREVENCIÓN DE RIESGOS PARA ADMINISTRACIÓN MUNICIPAL.,,,,,,,,,,,,
2025-10-22 17:00:00,Contrato de Suministro para Farmacia popular de Rengo  año 2025-2026,,,,,,,,,,,,
2025-10-06 15:00:00,LABORATORIO MOVIL ESCUELA EL NARANJAL,,,,,,,,,,,,
2025-10-08 16:00:00,CONS. Y MEJORAMIENTO ESC. G-16 MANTENIMIENTO,,,,,,,,,,,,
2025-10-08 16:00:00,CONS. CANALETAS ESC. GABRIELA MISTRAL DAEM,,,,,,,,,,,,
2025-10-08 14:47:00,ADQUISICION SALA MODULAR ESCUELA HORNOS DE HUAQUEN,,,,,,,,,,,,
2025-10-07 14:25:00,MEJORAMIENTO ZONAS DE EVACUACIÓN TSUNAMI,,,,,,,,,,,,
2025-10-06 16:00:00,SERVICIO DE GUARDIAS SEGURIDAD PRIVADA,,,,,,,,,,,,
2025-10-13 16:30:00,DISEÑO: PAV de ACERAS y PJES. BARRIO LAS QUEBRADAS,,,,,,,,,,,,
2025-10-06 16:00:00,MODIFICACIÓN RED DE AGUA POTABLE CALLE LIHUEN LA LIGUA,,,,,,,,,,,,
2025-10-08 10:00:00,SERVICIO DE URGENCIAS RURAL POSTA LAS PARCELAS,,,,,,,,,,,,
2025-10-22 10:00:00,MEJORAMIENTO SALON D.O.R. y CONSERVATORIO IRIS BF,,,,,,,,,,,,
2025-11-26 10:00:00,CONSTRUCCIÓN de VIVIENDAS DS 10 ST. RESIDENTE,,,,,,,,,,,,
2025-10-08 15:00:00,Estudios de mecánicas de suelos para diversos proyectos en la comuna de San Pedro de la Paz,,,,,,,,,,,,
2025-10-06 15:01:00,SDA 5065 SEGUROS DE ACCIDENTES GENERALES PARA VEHICULOS Y MAQUINARIA MUNICIPAL,,,,,,,,,,,,
2025-10-14 15:00:00,Servicio de tala de alta y corte de copa de árboles sector Villa San Pedro,,,,,,,,,,,,
2025-10-20 15:00:00,Nuevo llamado Mejoramiento droguería comunal de San Pedro de la Paz,,,,,,,,,,,,
2025-10-09 12:01:00, MANTENCIÓN DE PLANTAS DE TRATAMIENTO DE AGUAS SERVIDAS”,,,,,,,,,,,,
2025-10-08 17:00:00,SERVICIO DE PINTADO Y EMPASTADO DEL GIMNASIO MUNICIPAL,,,,,,,,,,,,
2025-10-09 16:00:00,"CONSTRUCCION DE RADIER, GIMNASIO MUNICIPAL",,,,,,,,,,,,
2025-10-06 15:01:00,“CONSERVACIÓN ESCUELA CARMEN REVECO NÚÑEZ PAINE”,,,,,,,,,,,,
2025-10-09 17:00:00, MONITOR MULTIPARÁMETROS PARA AMBULANCIAS,,,,,,,,,,,,
2025-10-09 16:05:00,NORMALIZACON DE BOX Y SALA DE PROCEDIMIENTOS CESFAM EL BARRERO,,,,,,,,,,,,
2025-10-09 15:05:00,REPOSICIÓN SILLON DENTAL CESFAM LA PINCOYA,,,,,,,,,,,,
2025-10-14 11:00:00,“CONSTRUCCIÓN ACCESO A SENDEROS CERRO MANQUEHUE COMUNA DE HUECHURABA,,,,,,,,,,,,
2025-10-14 11:00:00,PMU IRAL: MEJ. BANDEJON CENTRAL AV.LAS TORRES,,,,,,,,,,,,
2025-10-15 11:30:00,SERVICIO DE  TALA  DE ÁRBOLES DE ALTURA SUPERIOR A 18 METROS Y OTROS,,,,,,,,,,,,
2025-10-08 10:17:00,ADQUISICION DE CARTUCHOS TINTAS Y TONER,,,,,,,,,,,,
2025-10-23 14:00:00,Mejoramiento Platabanda Villa Minera Andina,,,,,,,,,,,,
2025-10-07 14:00:00,Mejoramiento Multicancha y Area Verde  La Gloria,,,,,,,,,,,,
2025-10-14 14:00:00,ATO Sistema Alcantarillado Vilcuya-Bocatoma,,,,,,,,,,,,
2025-10-16 14:00:00,Instalacion Red Atrapa Pelotas Canchas Borde Rio,,,,,,,,,,,,
2025-10-14 14:00:00,Mi Barrio mas Sustentable y Ecologico QMB CHOLA,,,,,,,,,,,,
2025-10-13 15:30:00,Servicio de Mantención Señalizaciones de Transito 2025-2029,,,,,,,,,,,,
2025-10-09 15:30:00,Servicios de Telefonía seguridad e internet,,,,,,,,,,,,
2025-10-13 15:01:00,Servicio de Publicidad y Difusión Radial 2025-2029 III,,,,,,,,,,,,
2025-10-13 15:30:00,Servicio de Publicidad y Difusión Digital 2025-2029 III,,,,,,,,,,,,
2025-10-07 15:01:00,Solución de aguas lluvias para calles en la comuna,,,,,,,,,,,,
2025-10-23 14:00:00,PROYECTO ALCANTARILLADO CAMINO REAL SAN FERNANDO,,,,,,,,,,,,
2025-10-27 15:01:00,“MEJORAMIENTO BÁSICO DE CAMINOS RURALES 2025”,,,,,,,,,,,,
2025-10-14 13:22:00,MEJ. DEL SIST. DE ALUM. PÚBLICO EN P. ABEL BOUCHON,,,,,,,,,,,,
2025-10-09 17:00:00,SERVICIO DE MOVILIZACIÓN DEL PROGRAMA RED LOCAL,,,,,,,,,,,,
2025-10-13 18:00:00,ADQUISICIÓN DE VEHÍCULO,,,,,,,,,,,,
2025-10-09 10:00:00,CONTRATO DE SUMINISTRO DE COMBUSTIBLES,,,,,,,,,,,,
2025-10-14 10:00:00,SERVICIO MEJORAMIENTO PLAZA LOS TRIANGULOS,,,,,,,,,,,,
2025-10-16 10:00:00,REPARACION SEMAFOROS OHIGGINS Y AVDA MAC IVER,,,,,,,,,,,,
2025-10-10 15:30:00,ADQUISICIÓN DE JUGUETES NAVIDEÑOS 2025,,,,,,,,,,,,
2025-10-09 15:00:00,SERVICIO DE GUARDIAS DE SEGURIDAD EXPO QTA 2025,,,,,,,,,,,,
2025-10-13 17:00:00,SEGUNDO LLDO SUM E INST MODULOS CARPAS TOLDOS EXPO,,,,,,,,,,,,
2025-10-13 15:30:00,SUM INSTL ELEC PROV GRUPOS ELECTROGENO EXPO 2025,,,,,,,,,,,,
2025-10-13 16:00:00,Ctto. Siministro Servicio Otorrinolaringología ,,,,,,,,,,,,
2025-10-13 16:00:00,INSTALACIÓN CENTRAL DE GLP Y RED DE GAS-SEGURIDAD,,,,,,,,,,,,
2025-10-10 09:00:00,Servicio de producción de evento del Aniversario de Puerto Varas 2025,,,,,,,,,,,,
2025-10-06 15:05:00,ADQUISICIÓN EQUIPAMIENTO PARA UAPORRINO PTO VARAS,,,,,,,,,,,,
2025-10-20 15:00:00,SERVICIO DE ASEO CAMPUS ROMULO J. PEÑA UDA,,,,,,,,,,,,
2025-10-10 16:48:00,ESTUDIOS AMBIENTALES Y ADENDAS DIA,,,,,,,,,,,,
2025-10-07 15:03:00,INSUMOS DENTALES DEPTO. DE SALUD PUYEHUE,,,,,,,,,,,,
2025-10-13 18:00:00,NIVELACIÓN DE AULAS AA UNIVERSIDAD DEL BÍO-BÍO,,,,,,,,,,,,
2025-11-03 15:30:00,CONSTRUCCIÒN CANCHA SINTÈTICA VILLA PATAGONIA COMUNA DE HUALAIHUÈ,,,,,,,,,,,,
2025-11-03 15:30:00,CONSTRUCCIÒN PLAZA RECREATIVA LOS TEPUALES COMUNA DE HUALAIHUÈ,,,,,,,,,,,,
2025-10-06 18:00:00,ADQUISICION DE VESTUARIO INSTITUCIONAL MUNI LANCO,,,,,,,,,,,,
2025-10-10 15:31:00,SERVICIO DE PRODUCCIÓN EXPO FUTRONO,,,,,,,,,,,,
2025-10-06 15:08:00,SERVICIO DE TRANSPORTE SALIDAS EDUCATIVAS,,,,,,,,,,,,
2025-10-09 15:00:00,MOBILIARIO FARMACIA CES PROG. FOFAR SM-270,,,,,,,,,,,,
2025-10-22 15:00:00,RENOVACIÓN DE LICENCIAS AUTODESK AUTOCAD,,,,,,,,,,,,
2025-10-06 15:00:00,Suministro de combustible diesel para la CJF,,,,,,,,,,,,
2025-10-21 12:00:00,Estaciones de Recepción Volumétrica - JF,,,,,,,,,,,,
2025-10-22 15:00:00,OFICINA MODULAR ARMABLE,,,,,,,,,,,,
2025-10-13 16:00:00,UNIFORMES EJECUTIVOS PARA DAMAS PRIMAVERA -VERANO,,,,,,,,,,,,
2025-10-06 16:00:00,ADQUISICIÓN MINIBUS MUNICIPAL,,,,,,,,,,,,
2025-10-15 16:00:00,ADQUISICIÓN CLINICA MEDICA Y DENTAL MOVIL ,,,,,,,,,,,,
2025-10-06 16:00:00,ADQUISICIÓN E INSTALACIÓN DE LETRAS VOLUMETRICAS,,,,,,,,,,,,
2025-10-13 15:34:00,HABILITACION BOX MULTIPTOPOSITOS CESFAM CHAÑARAL,,,,,,,,,,,,
2025-11-03 15:30:00,SERVICIO DE INTERNET Y REDES DE DATOS QUELLÓN,,,,,,,,,,,,
2025-10-08 11:00:00,Mejoramiento Hito Cero Comuna de Quellón,,,,,,,,,,,,
2025-10-08 12:00:00,Reposición Paraderos Residenciales Comuna Quellón,,,,,,,,,,,,
2025-10-08 14:00:00,Mejoramiento Seguridad Peatonal Comuna Quellón,,,,,,,,,,,,
2025-10-14 14:00:00,Adquisición de Vehículo con Hidroelevador,,,,,,,,,,,,
2025-10-23 11:08:00,Conservación y Habilitación Centro Productivo,,,,,,,,,,,,
2025-10-07 11:00:00,CONSTRUCCION NUEVO POZO COOPERATIVA DOMINGO ORTÍZ,,,,,,,,,,,,
2025-10-16 16:30:00,REPOSICION DE LUMNARIAS PÚBLICA SECTOR RURAL ALHUE,,,,,,,,,,,,
2025-10-09 17:30:00,SUMINISTRO SELLOS VERDES PERMISO DE CIRCULACION,,,,,,,,,,,,
2025-10-07 19:00:00,CONSULTAS INTEGRALES DE OFTAMOLOGIA PARA USUARIOS DE LOS CENTROS DE SALUD COMUNA ALHUÉ,,,,,,,,,,,,
2025-10-07 19:00:00,MAMOGRAFÍAS EN CLÍNICA MÓVIL PARA USUARIAS DE LOS CENTROS DE SALUD DE LA COMUNA DE ALHUÉ 2025,,,,,,,,,,,,
2025-10-07 16:30:00,SERVICIO DE CENA Y BANQUETERIA EDUCACIÓN 2025,,,,,,,,,,,,
2025-10-13 16:30:00,ADQ. NOTEBOOKS PARA ESTUDIANTES AÑO 2025,,,,,,,,,,,,
2025-10-08 13:05:00,ADQUISICION DE MATERIALES DE CONSTRUCCION PARA PROGRAMA HABITABILIDAD 2024.,,,,,,,,,,,,
2025-10-09 12:40:00,CONVENIO DE OXIGENO MEDICINAL PARA PACIENTES,,,,,,,,,,,,
2025-10-29 10:00:00,MEJORAMIENTO PLAZA LOS ALAMOS SAN PABLO,,,,,,,,,,,,
2025-10-29 10:00:00,REPOSICION PLAZA VILLA LOS JARDINES COMUNA SAN PABLO,,,,,,,,,,,,
2025-10-14 15:00:00,PARCHE ARMADA DE CHILE PARA TENIDA PIXELADA,,,,,,,,,,,,
2025-10-13 15:01:00,PINTURAS VARIAS PARA LA ARMADA.,,,,,,,,,,,,
2025-10-17 12:00:00,ADQ. DE VESTUARIO Y ACCESORIOS PARA EQUIPO INICIAL CADETES 2026,,,,,,,,,,,,
2025-10-15 16:00:00,ADQ. DE COMABATE PIXEL AZUL EQ. INICIAL CADETES ,,,,,,,,,,,,
2025-10-08 12:00:00,GTM-ESTUDIO PROYECCIÓN DE INFRAESTRUCTURA,,,,,,,,,,,,
2025-10-06 15:00:00,ADQUISICIÓN DE BUSES MUNICIPALES,,,,,,,,,,,,
2025-10-09 15:30:00,MEJORAMIENTO PASAJES COMUNA DE LA GRANJA,,,,,,,,,,,,
2025-10-06 15:00:00,SERVICIO DE CONTROL DE PLAGAS,,,,,,,,,,,,
2025-10-21 12:00:00,JGOD PPU 47-2025 152025 AFL030 - SUMINISTRO Y DISTRIBUCIÓN DE LUBRICANTES GRASAS Y SOLVENTES PARA LA FUERZA AÉREA DE CHILE,,,,,,,,,,,,
2025-10-14 12:00:00,JGOD PPU 64-2025 DTYS 0262025 AFL030 CONTRATACIÓN DEL SERVICIO DE ARRIENDO DE VEHÍCULOS MENORES HÍBRIDOS PARA LA FUERZA AÉREA DE CHILE,,,,,,,,,,,,
2025-10-08 12:00:00,GTM-ADQ. VESTURIO INTERIOR PARA LA FACH,,,,,,,,,,,,
2025-10-10 12:00:00,SERVICIO DE TELEFONÍA MOVIL DIGITAL,,,,,,,,,,,,
2025-10-09 09:00:00,SERVICIO DE MANTENIMIENTO DE JARDINES Y AREAS VERDES EN LOS CONJUNTOS HABITACIONALES: EDIFICIO HALCÓN VILLA LOS REFUGIOS Y VILLA FACH 423-2025.,,,,,,,,,,,,
2025-10-10 09:00:00,SERVICIO DE MANTENCION ANUAL DE BOMBAS DE ELEVACION DE AGUA POTABLE EN CONJUNTOS HABITACIONALES PERTENECIENTES A LA DIVISION DE BIENESTAR SOCIAL 347-2025.,,,,,,,,,,,,
2025-10-14 12:00:00,JGOD 41-057-001 AFL001 - ESTUDIO DEL SISTEMA ELÉCTRICO PARA LA RECUPERACIÓN DE LA INFRAESTRUCTURA DE CLIMATIZACIÓN DEL EDIFICIO COMODORO ARTURO MERINO BENÍTEZ CAMB,,,,,,,,,,,,
2025-10-13 16:00:00,LEYES ESPECIALES SA. N° 062025 SERVICIO DE REMODELACIÓN Y HABILITACIÓN CONTRALORÍA MÉDICA DEL CEAFOSS.,,,,,,,,,,,,
2025-10-06 15:00:00,DGC - SERVICIO DE ASEO A CUARTELES INSTITUCIONALES,,,,,,,,,,,,
2025-10-08 15:00:00,DAL - ADQUISICION DE STATION WAGON Y CAMIONETAS,,,,,,,,,,,,
2025-10-08 15:00:00,DEPARMUN - ADQ. CHALECOS ANTIBALAS PROTECCIÓN IIIA,,,,,,,,,,,,
2025-10-13 15:00:00,JENATID ADQUISICIÓN DE EQUIPOS COMPUTACIONALES,,,,,,,,,,,,
2025-10-06 15:00:00,SERVICIO DE MONITOREO DE MEDIOS DE COMUNICACIÓN SOCIAL ABIERTOS,,,,,,,,,,,,
2025-10-16 12:00:00,MAVEMO- CONTRATO SERVICIO REVISION TECNICA TIPO A Y B,,,,,,,,,,,,
2025-10-10 12:00:00,SERVICIO DE ENLACE DEDICADO DE INTERNET ,,,,,,,,,,,,
2025-10-06 16:00:00,DEINFRA - SUM. PARA SERV. DE IMPRESIÓN E INSTALACIÓN DE SEÑALETICA E INFOGRAFÍA.,,,,,,,,,,,,
2025-10-08 15:00:00,DEPARMUN - ADQUISICION DE FUNDAS TACTICAS Y PORTA CARGADORES,,,,,,,,,,,,
2025-10-13 15:01:00,DGR - CONTRATACIÓN DE SERVICIOS PROFESIONALES DE AUDITORÍA EXTERNA  PARA LA PDI,,,,,,,,,,,,
2025-10-13 17:00:00,DEINFRA - OBRAS EXTERIORES BIROINCRI VITACURA ,,,,,,,,,,,,
2025-10-14 12:00:00,SERVICIO DE ENTRENAMIENTO PARA OBTENCIÓN DE HABILIDADES EC135 PARA PILOTOS DE BAPOL,,,,,,,,,,,,
2025-10-20 15:00:00,SIMULADOR DE CONDUCCIÓN DE VEHÍCULOS LIVIANOS PARA EL CENTRO DE CAPACITACIÓN PROFESIONAL DE LA PDI,,,,,,,,,,,,
2025-10-06 15:00:00,SERVICIOS DE MANTENCIONES GENERADORES,,,,,,,,,,,,
2025-10-06 15:00:00,MANTENCIONES BOMBAS DE AGUA CESFAM LOS MUERMOS,,,,,,,,,,,,
2025-10-06 15:00:00,MANTENCIONES DE EQUIPOS DENTALES CESFAM LOS MUERMO,,,,,,,,,,,,
2025-10-06 15:00:00,SERVICIOS DE MANTENCIÓN ECÓGRAFO Y MAMÓGRAFO,,,,,,,,,,,,
2025-10-09 10:00:00,CONVENIO SUMINISTRO PARA ADQUISICION  AGUA POTABLE,,,,,,,,,,,,
2025-10-13 17:30:00,Ampliación y remodelación botiquín CESFAM El Palqu,,,,,,,,,,,,
2025-10-13 16:17:00,PMI-Mobiliario Unidad de Esterilizacion Comunal,,,,,,,,,,,,
2025-10-24 16:00:00,Conc. Recolección y Transporte de Residuos La Cruz,,,,,,,,,,,,
2025-10-15 12:00:00,MEJ. MULTICHANCHA Y PLAZA VILLA CENTENARIO LA CRUZ,,,,,,,,,,,,
2025-10-10 16:00:00,MEJ. ALUMBRADO PUBLICO LA PUNTILLA LA CRUZ,,,,,,,,,,,,
2025-10-10 16:30:00,MEJ. ALUMBRADO PÚBLICO POZA CRISTALINA LA CRUZ,,,,,,,,,,,,
2025-10-20 16:00:00,Diseño Construcción Sede C.D Jocelyn La Cruz,,,,,,,,,,,,
2025-11-03 15:30:00,MEJORAMIENTO LUMINARIAS PLAZA DE LA CRUZ,,,,,,,,,,,,
2025-10-06 15:15:00,Servicio de Suministro Arriendo de Vehículos para 4 Personas para la Participación en Actividades Dentro y Fuera de la Comuna de Lolol Año 2025-2026,,,,,,,,,,,,
2025-10-06 15:05:00,Tercer Llamado Contrato de Suministro de Materiales Didácticos para Abastecimiento de los Establecimientos JUNJI Años 2025 y 2026,,,,,,,,,,,,
2025-10-13 15:05:00,Contrato de Suministro de Materiales de Construcción para Ayudas Sociales 2025-2026,,,,,,,,,,,,
2025-11-03 15:05:00,Contrato de Concesión Servicio de Aseo Ornato y Peonetas para Camión Recolector de Residuos Domiciliarios para la Ilustre Municipalidad de Lolol,,,,,,,,,,,,
2025-10-06 15:19:00,SERVICIO DE GESTION DE FLOTA MEDIANTE MONITOREO Y CONTROL SATELITAL POR GPS PARA LOS VEHICULOS MUNICIPALES,,,,,,,,,,,,
2025-10-10 13:47:00,SERVICIO REPARACIÓN COLECTOR AGUAS SERVIDAS EN COLEGIO KONRAD ADENAUER LOTA,,,,,,,,,,,,
2025-10-06 15:01:00,CANASTA GASTROENTEROLOGIA 2025,,,,,,,,,,,,
2025-11-05 11:45:00,CONSTRUCCION CANCHA EL BLANCO LOTA,,,,,,,,,,,,
2025-10-30 11:45:00,CONSTRUCCION PARQUE DE CALISTENIA Y STREET WORKOUT LOTA,,,,,,,,,,,,
2025-10-20 15:00:00,SVC MEJORAMIENTO MTTO ACCESIB POLICLINICO FACH,,,,,,,,,,,,
2025-10-06 15:00:00,SERVICIO CATERING Y PRODUCCION DE EVENTOS,,,,,,,,,,,,
2025-10-13 15:00:00,SERVICIO DE MANTENIMIENTO PREVENTIVO A UNIDAD COMPRESORA DE AIRE.,,,,,,,,,,,,
2025-10-08 16:00:00,ADQUISICIÓN DE UN SISTEMA DE VIDEO VIGILANCIA PARA UNA BOYA DART SERVICIO HIDROGRÁFICO Y OCEANOGRÁFICO DE LA ARMADA.,,,,,,,,,,,,
2025-10-07 18:28:00,Póliza de Seguro Bus Municipal,,,,,,,,,,,,
2025-10-13 15:01:00,SERVIDOR,,,,,,,,,,,,
2025-10-13 19:57:00,SUMINISTRO DE HARINA DE TRIGO PERLA E INTEGRAL O EQUIVALENTE PARA LA PANADERÍA NAVAL,,,,,,,,,,,,
2025-10-07 10:30:00,ADQUISICIÓN DE BANDERAS Y ROPA DE CAMA,,,,,,,,,,,,
2025-10-06 15:01:00,MANT. CORR. CAMBIO BOMBA DE AGUA ORIGINAL GH-056,,,,,,,,,,,,
2025-10-09 15:35:00,SERVICIO DE TRANSPORTE PARA ESTABL DE EDUCACIÓN,,,,,,,,,,,,
2025-10-07 13:30:00,SERVICIOS PRODUCCION DE EVENTO PARA REALIZACION DE JORNADA EQUIDAD EN SALUD RURAL AÑO 2025.,,,,,,,,,,,,
2025-10-08 16:00:00,SERVICIO DE PROVISIÓN E INSTALACIÓN DE 120 M2 DE PISO VINILICO PARA LA DIRECCIÓN DE RECUPERACIÓN DE UNIDADES DE LA ARMADA (T.) ,,,,,,,,,,,,
2025-10-14 09:51:00,REPARACIÓN Y MODIFICACIÓN ACUMULADOR DE AGUA,,,,,,,,,,,,
2025-10-20 15:30:00,REPOSICIÓN TECHUMBRE BLOCK 217-225-245 M.MERCANTE,,,,,,,,,,,,
2025-10-06 16:00:00,SERVICIO DE CONTROL Y GESTION DE MULTAS DEL CENTRO DE ABASTECIMIENTO VALPARAÍSO,,,,,,,,,,,,
2025-10-10 15:00:00,SERVICIO DE MANTENCIÓN Y REPARACIÓN PUERTAS DE ACCESO DIRECCIÓN DE ABASTECIMIENTO DE LA ARMADA,,,,,,,,,,,,
2025-10-09 15:10:00,Serv Mant. Preventiva correc. autoclave y lavadora,,,,,,,,,,,,
2025-10-10 17:00:00,MANTENC PREVENTIVA DE CUATRO VENTILADORES MECANIC.,,,,,,,,,,,,
2025-10-09 16:00:00,TELEFONIA FIJA CON DIRECTEMAR.,,,,,,,,,,,,
2025-10-09 17:00:00,ADQUISICIÓN DE HERRAMIENTAS Y ACCESORIOS PROFENIX,,,,,,,,,,,,
2025-10-09 16:00:00,SERVICIO DE TRANSPORTE DE SEÑAL SATELITAL PARA CONECTAR DOS EMBARCACIONES CON LA WAN DIRECTEMAR POR UN PERÍODO DE 24 MESES.,,,,,,,,,,,,
2025-10-30 16:00:00,ADQUISICIÓN DEL SERVICIO DE TRANSPORTE DE SEÑAL TERRESTRE PARA CONECTAR EL COMPLEJO DIRECCIONES TÉCNICAS MARÍTIMAS CON EL NODO DIRECTEMAR POR UN PERÍODO DE 36 MESES,,,,,,,,,,,,
2025-10-13 15:01:00,ADQUISICIÓN - RENOVACIÓN DE LICENCIAS.,,,,,,,,,,,,
2025-10-07 10:00:00,CONVENIO DE SUMINISTRO MANT. AIRE ACONDICIONADO,,,,,,,,,,,,
2025-10-06 15:00:00,SEGUNDO LLAMADO ADQUISICION DE MEDICAMENTOS CESFAM,,,,,,,,,,,,
2025-10-09 14:26:00,ADQUISICION DE CONTENEDORES POLIETILENO R.S.D.,,,,,,,,,,,,
2025-10-13 16:13:00,Adquisción de estanque para agua,,,,,,,,,,,,
2025-10-06 16:16:00,CONTRATACION DE SERVICIOS PROFESIONAL ODONTOLOGO,,,,,,,,,,,,
2025-10-06 15:00:00,COMPRA DE MOBILIARIO MUNICIPALIDAD DE MARIA ELENA,,,,,,,,,,,,
2025-10-24 18:00:00,LICITACION PRIVADA SERVICIOS DE INTERNET CENTRAL TELEF. IP Y F.O.,,,,,,,,,,,,
2025-10-09 16:15:00,SEGURO COMPLEMENTARIO DE SALUD Y VIDA,,,,,,,,,,,,
2025-10-06 16:00:00,COMBUSTIBLES PARA LA ESCUELA DE GRUMETES,,,,,,,,,,,,
2025-10-08 15:01:00,CAMBIO SUMINISTRO E INSTALACIÓN DE PLANCHAS DE ZINC,,,,,,,,,,,,
2025-10-13 15:10:00,NORMALIZACIÓN ELÉCTRICA,,,,,,,,,,,,
2025-10-14 09:00:00,“ADQUISICION DE AUTOCAD 2025”,,,,,,,,,,,,
2025-10-08 15:00:00,MANTENCION Y REGARGA BANCO CO2 LIENTUR,,,,,,,,,,,,
2025-10-08 18:05:00,MANTENIMIENTO PREVENTIVO VEHÍCULOS FISCALES GMAYS.,,,,,,,,,,,,
2025-10-08 18:00:00,MANTENCIÓN SALA BOMBAS AGUA  5° COM. CASABLANCA.,,,,,,,,,,,,
2025-10-08 11:00:00,MANT. SALA BOMBAS DE AGUA Y CALD. 4TA. COM. CONCÓN,,,,,,,,,,,,
2025-10-15 10:00:00,OBRA MENOR LOSA TECHADA ESFOCAR TEMUCO,,,,,,,,,,,,
2025-10-07 09:00:00,CONST. ZONA SEG.CARGA Y DESCARGA ARMAMENTO 4  COM.,,,,,,,,,,,,
2025-11-04 11:00:00,MEJ. SIST. ELÉCT. PREF. CAUTÍN Y  2° COM. TEMUCO,,,,,,,,,,,,
2025-10-08 15:15:00,SERVICIOS DE BANQUETERÍA PRODUCCIÓN Y EVENTO “CENA DEL DÍA DEL PROFESOR Y ASISTENTE DE LA EDUCACIÓN 2025”.,,,,,,,,,,,,
2025-10-16 16:00:00,SERVICIO DE LA ESPECIALIDAD DE CUELLO Y CABEZA,,,,,,,,,,,,
2025-10-16 16:00:00,SERVICIO DE HOSPITALIZACIÓN DOMICILIARIA,,,,,,,,,,,,
2025-10-30 09:02:00,SERVICIO DE MANTENCIÓN CONSERVACIÓN RESTAURACIÓN,,,,,,,,,,,,
2025-10-10 09:00:00,“SERVICIO DE PRODUCCIÓN TÉCNICA DE EVENTO: CELEBRACIÓN “DÍA DEL DIRIGENTE 2025”.,,,,,,,,,,,,
2025-10-13 20:00:00,REEMPLAZO VENTANAS TERMOPANEL VV.FF. PUERTO NATALE,,,,,,,,,,,,
2025-10-13 20:00:00,MANTENCIÓN REPAR E INSP. CLUTCH OPV-83 FUENTEALBA,,,,,,,,,,,,
2025-10-06 15:00:00,LE INS2 INSUMOS CLINICOS,,,,,,,,,,,,
2025-10-09 15:00:00,LE REAC INSUMOS CLINICOS Y REACTIVOS:,,,,,,,,,,,,
2025-10-10 11:00:00,LE FAR2 ADQUISICION DE FARMACOS,,,,,,,,,,,,
2025-10-13 15:05:00,SERVICIO INSTALACIÓN LÍNEAS DE VIDA HOSPITAL NAVAL,,,,,,,,,,,,
2025-10-13 16:00:00,ADQUISICION DE GIROESFERA KIT MANTENIMIENTO Y REGULADOR DE VOLTAJE PARA LSG TALCAHUANO,,,,,,,,,,,,
2025-10-17 11:00:00,REPARACIÓN DE TECHUMBRE EN VIVIENDA FISCAL,,,,,,,,,,,,
2025-10-08 14:00:00,CONST. REDUCTORES Y DEMARCACIÓN VIAL LONCOCHE,,,,,,,,,,,,
2025-11-04 14:00:00,MEJORAMIENTO ESTADIO MUNICIPAL LONCOCHE,,,,,,,,,,,,
2025-10-07 10:01:00,software tarjetero digital DSM Loncoche,,,,,,,,,,,,
2025-10-07 12:05:00,SERVICIO DE REMPLAZO DE 26 VENTANAS EN VIVIENDAS FISCALES CHONCHI,,,,,,,,,,,,
2025-10-08 16:00:00,SERVICIO DE REPARACIÓN DE PISO ESTRUCTURAL EN VIVIENDA FISCAL,,,,,,,,,,,,
2025-10-06 19:14:00,MATERIALES ELECTRICOS PARA OBRAS,,,,,,,,,,,,
2025-10-13 17:00:00,ARRIENDO DE IMPRESORAS MULTIFUNCIONALES,,,,,,,,,,,,
2025-10-06 15:10:00,ESTUDIO DE PROSPECCION GEOFISICA PARA ABASTOS,,,,,,,,,,,,
2025-10-10 18:37:00,REPARACIONES BACHES DE EMERGENCIA,,,,,,,,,,,,
2025-10-06 15:00:00,ESTADO DE EXCEPCIÓN CONSTITUCIONAL MZS  PETROLEO DIESEL PARA GENERADORES ,,,,,,,,,,,,
2025-10-14 15:04:00,ADQUISICIÓN E INSTALACIÓN DE PASTO SINTÉTICO Y BA,,,,,,,,,,,,
2025-10-07 10:00:00,SERVICIO DE DETECCION Y REPARACION DE FILTRACION DE AGUA POTABLE INTERIOR COMANDACIA,,,,,,,,,,,,
2025-10-13 15:01:00,MATERIALES PARA HABITABILIDADES COMBASETALC.,,,,,,,,,,,,
2025-10-07 15:30:00,AMPLIACIÓN CENTRO COMUNITARIO PELLUHUE,,,,,,,,,,,,
2025-10-09 17:42:00,CONTRATO DE SUMINISTRO REPUESTOS VEHICULOS PESADOS,,,,,,,,,,,,
2025-10-29 15:30:00,EXTENSIÓN AGUA POTABLE Y AGUAS SERVIDAS,,,,,,,,,,,,
2025-10-10 16:00:00,PLAN COMUNAL DE ESTERILIZACION MUNICIPAL COMUNA DE PELLUHUE,,,,,,,,,,,,
2025-10-30 15:30:00,Mejoramiento Circulaciones Parque Costanera,,,,,,,,,,,,
2025-10-06 16:00:00,CONVENIO SUMINISTRO-SANITIZACIÓN Y DESRATIZACION,,,,,,,,,,,,
2025-10-06 15:01:00,SERVICIO DE ASEO Y LIMPIEZA PARA C.O.Ira.Z.N.,,,,,,,,,,,,
2025-10-13 15:30:00,ADQUISICIÓN DE MATERIALES PARA MANTENIMIENTO ,,,,,,,,,,,,
2025-10-13 16:00:00,ADQUISICIÓN DE VÍVERES PARA CAFETERÍA NAVAL,,,,,,,,,,,,
2025-10-16 15:00:00,SERVICIO DE RECOLECCIÓN DOMICILIARIA EN LA COMUNA ,,,,,,,,,,,,
2025-11-03 17:00:00,Mejoramiento Plaza Las Hortensias Comuna de Santo Domingo. CÓDIGO 1-B-2024-157,,,,,,,,,,,,
2025-10-27 16:12:00,Mejoramiento Cierro Y Canchas De Tenis Complejo Deportivo Juan Vera Velásquez Santo Domingo. CÓDIGO BIP 40045383-0,,,,,,,,,,,,
2025-10-13 17:00:00,Servicio de retiro de cubierta de asbesto cemento PMI San Enrique Comuna de Santo Domingo,,,,,,,,,,,,
2025-10-13 15:05:00,CONTRATACION DE SERVICIO DE SEGUROS PARA VEHICULOS,,,,,,,,,,,,
2025-10-09 15:00:00,ADQ. DE MAQUINA DOBLADORA Y PEGADORA DE PAPEL,,,,,,,,,,,,
2025-10-16 15:00:00,SERVICIO DE TRANSPORTE DE PASAJEROS CON CHOFER PAR,,,,,,,,,,,,
2025-10-06 19:56:00,SERVICIO MANTENCIÓN Y RECUPERACIÓN DE ESTANQUES COMBUSTIBLE,,,,,,,,,,,,
2025-10-06 16:35:00,ADQUISICIÓN DE ARTÍCULOS DE OFICINA DEPTO. SALUD,,,,,,,,,,,,
2025-10-13 15:10:00,SUMINISTRO DE LENTES ÓPTICOS RESOLUTIVIDAD,,,,,,,,,,,,
2025-10-07 15:30:00,Insumos Médicos ,,,,,,,,,,,,
2025-10-13 15:30:00,Equipos Electrónicos ,,,,,,,,,,,,
2025-10-09 15:00:00,S.A. 107 SUSCRIPCIÓN MICROSOFT 365,,,,,,,,,,,,
2025-10-09 15:00:00,CABINA DE REVELADO LACRIMVPO,,,,,,,,,,,,
2025-10-09 15:00:00,CÁMARA DE REVELADO LACRIMVPO,,,,,,,,,,,,
2025-10-09 15:00:00,BANCO DE EXÁMEN DE EVIDENCIAS LACRIMVPO,,,,,,,,,,,,
2025-10-10 16:18:00,SERVICIO DE MANTENIMIENTO PARQUE VEHICULAR,,,,,,,,,,,,
2025-10-08 20:00:00,MOBILIARIO UUDD DE LA REPOLAG,,,,,,,,,,,,
2025-10-23 15:00:00,EQUIPOS DE AUDIO Y PROYECCIÓN - AUDITORIO REPOLAG,,,,,,,,,,,,
2025-10-15 19:55:00,MEJORAMIENTO Y NORMALIZACIÓN SISTEMA ELECTRICO EDIFICIO MUNICIPAL CURACO DE VELEZ,,,,,,,,,,,,
2025-10-29 19:55:00,CONSTRUCCION ALUMBRADO FOTOVOLTAICO SECTOR TOLQUIEN CURACO DE VELEZ,,,,,,,,,,,,
2025-10-06 15:00:00,REPOSICION MAQUINARIA MUNICIPAL CURACO DE VELEZ,,,,,,,,,,,,
2025-10-09 19:55:00,CONSTRUCCION MIRADOR PARQUE PALQUI CURACO DE VELEZ,,,,,,,,,,,,
2025-10-08 12:00:00,Srv. aumento capacidad hídrica y almacenamiento,,,,,,,,,,,,
2025-10-21 12:00:00,Serv. reparación y mantto de boulevard principal,,,,,,,,,,,,
2025-10-17 09:30:00,CONSERVACIÓN PERIÓDICA CAMINO RUNGUE-LO ECHEVERS ,,,,,,,,,,,,
2025-10-10 16:30:00,ADQUISICION MOBILIARIO CONSERVACION  PDI LEBU,,,,,,,,,,,,
2025-10-09 15:30:00,ADQUISICIÓN DE 01 CAMIÓN DE CARGA EQUIPADO CON CARROCERÍA CERRADA PARA CARABINEROS DE CHILE SEGÚN BASES ADMINISTRATIVAS Y TÉCNICAS,,,,,,,,,,,,
2025-10-13 15:30:00,CONTRATACIÓN DEL SERVICIO DE ARRIENDO DE 01 VEHÍCULO TIPO MINIBÚS STATION WAGON O SUV PARA EL TRANSPORTE DE PASAJEROS PARA LA PREFECTURA DE SEGURIDAD PRIVADA O.S.10 DE CARABINEROS DE CHILE SEGÚN BASES ADMINISTRATIVAS Y TÉCNICAS,,,,,,,,,,,,
2025-10-08 15:30:00,ADQUISICIÓN DE REPUESTOS PARA VEHÍCULOS MARCA TOYOTA PARA STOCK DE BODEGA DEL DEPARTAMENTO DE TRANSPORTES L.3 DE CARGO DE CARABINEROS DE CHILE,,,,,,,,,,,,
2025-10-15 15:30:00,ADQUISICIÓN DE REPUESTOS PARA MOTOCICLETAS MARCA: BMW MODELO G310 AÑO: 2022 PARA STOCK DE BODEGA DEL DEPARTAMENTO DE TRANSPORTES L.3 DE CARGO DE CARABINEROS DE CHILE SEGÚN BASES ADMINISTRATIVAS Y TÉCNICAS,,,,,,,,,,,,
2025-10-06 16:00:00,MFA.SUMINISTRO MEDICAMENTOS ELECTROLITOS VOLUMEN,,,,,,,,,,,,
2025-10-09 13:00:00,SERVICIO DE VENTA EMISION E IMPRESIÓN DE ENTRADAS 2026-2028               ,,,,,,,,,,,,
2025-11-17 15:10:00,MEJORAMIENTO SSHH ALUMNAS ETAPA N°1 COLEGIO TÉCNICO PROFESIONAL N°1 HONORIO OJEDA VALDERAS - ORD. N°737,,,,,,,,,,,,
2025-10-09 15:30:00,ADQUISICIÓN MOBILIARIO Y EQUIPAMIENTO PARA SALAS MODULARES DE EMERGENCIA ESCUELA RADIMADI ORD. N°85 SUBVENCIÓN REGULAR,,,,,,,,,,,,
